<?xml version="1.0" encoding="UTF-8"?>
<Users xmlns:xsi="http://www.w3.org/2001/XMLSchema-instance" xsi:noNamespaceSchemaLocation="usershema2.xsd">
  <user role="admin">
    <id>1A</id>
    <fname>Asmaa</fname>
    <lname>Omar</lname>
    <age>22</age>
    <email>asmaa23@gmail.com</email>
    <password>@Zab890</password>
    <phone>01101234565</phone>
    <address>Damitta</address>
  </user>
</Users>